{
 "$schema": "../schema/batterylake-research-2.0.json",
 "schema_version": "2.0.0",
 "dataset_id": "dataset_19",
 "ref_name": "2020_Oxford_Howey_LiIon_PathDep_MultiC_MultiT",
 "category": "cycle_aging",
 "timeseries": {
  "has_voltage_timeseries": true,
  "has_current_timeseries": true,
  "has_temperature_timeseries": true,
  "has_time_timeseries": true,
  "complete_v_i_t_timeseries": false,
  "resolution": "partial_waveforms",
  "signals_basis": "processed_data",
  "caveats": [
   "partial_raw",
   "processed_series_missing",
   "voltage_excursion_above_cutoff",
   "voltage_excursion_below_cutoff"
  ]
 },
 "soc": {
  "computable": true,
  "basis": "explicit_soc_column"
 },
 "soh": {
  "computable": true,
  "basis": "curated_supported_tasks_and_raw_capacity_signal",
  "blocking_flags": [],
  "curated_task_present": true
 },
 "capacity_degradation": {
  "present": false,
  "aging_type": "mixed",
  "n_cycles_total": null,
  "cycles_per_entity_median": null
 },
 "ocv": {
  "present": true,
  "confidence": "confirmed",
  "basis": "raw_docs: part_1 Readme.txt - pseudo-OCV discharge and charge at C/24"
 },
 "internal_resistance": {
  "present": true,
  "confidence": "confirmed",
  "basis": "raw_data: a non-zero internal-resistance column in 18 entities"
 },
 "eis": {
  "present": true,
  "basis": "raw_data: impedance-spectroscopy sweeps (frequency and impedance channels or EIS files)"
 },
 "thermal": {
  "temperature_logging": true,
  "thermal_characterization": false,
  "application_domain": "lab",
  "aging_type": "mixed"
 },
 "research_applicability": {
  "parameter_identification": true,
  "piml_calibration": false,
  "soh_rul_prediction": false,
  "simulation": true,
  "synthetic_data_generation": false
 },
 "suitable_tasks": [
  "SOH_estimation",
  "SOC_estimation",
  "digital_twin_calibration",
  "simulation",
  "EIS_characterization",
  "OCV_curve_extraction"
 ],
 "source_quality_flags": [
  "partial_raw",
  "voltage_excursion_above_cutoff",
  "voltage_excursion_below_cutoff"
 ],
 "provenance": {
  "derived_from": "datasets/dataset_19.json",
  "generated": "2026-10-14",
  "field_sources": {
   "ref_name": "dataset_record",
   "category": "folder_layout",
   "timeseries.*": "processed_data",
   "soc.*": "derived",
   "soh.*": "derived",
   "capacity_degradation.*": "derived",
   "ocv.*": "hand_checked",
   "internal_resistance.*": "raw_data",
   "eis.*": "raw_data",
   "thermal.*": "derived",
   "research_applicability.*": "derived",
   "suitable_tasks": "derived",
   "source_quality_flags": "dataset_record"
  },
  "confidence": "verified",
  "last_verified": "2026-10-14"
 }
}
