{
 "$schema": "../schema/batterylake-research-2.0.json",
 "schema_version": "2.0.0",
 "dataset_id": "dataset_29",
 "ref_name": "2025_Stanford_Chueh_MultiChem_Calendar_MultiT",
 "category": "calendar_aging",
 "timeseries": {
  "has_voltage_timeseries": true,
  "has_current_timeseries": true,
  "has_temperature_timeseries": false,
  "has_time_timeseries": true,
  "complete_v_i_t_timeseries": false,
  "resolution": "partial_waveforms",
  "signals_basis": "processed_data",
  "caveats": [
   "incomplete_raw_files",
   "partial_raw",
   "voltage_excursion_above_cutoff",
   "voltage_excursion_below_cutoff"
  ]
 },
 "soc": {
  "computable": true,
  "basis": "coulomb_counting_from_voltage_current"
 },
 "soh": {
  "computable": true,
  "basis": "curated_supported_tasks_and_raw_capacity_signal",
  "blocking_flags": [],
  "curated_task_present": true
 },
 "capacity_degradation": {
  "present": true,
  "aging_type": "calendar",
  "n_cycles_total": 9035,
  "cycles_per_entity_median": 28.5
 },
 "ocv": {
  "present": false,
  "confidence": null,
  "basis": null
 },
 "internal_resistance": {
  "present": false,
  "confidence": null,
  "basis": "no populated resistance column and no impedance measurement in the raw data"
 },
 "eis": {
  "present": false,
  "basis": null
 },
 "thermal": {
  "temperature_logging": false,
  "thermal_characterization": false,
  "application_domain": "lab",
  "aging_type": "calendar"
 },
 "research_applicability": {
  "parameter_identification": true,
  "piml_calibration": false,
  "soh_rul_prediction": true,
  "simulation": false,
  "synthetic_data_generation": false
 },
 "suitable_tasks": [
  "SOH_estimation",
  "SOC_estimation",
  "digital_twin_calibration"
 ],
 "source_quality_flags": [
  "incomplete_raw_files",
  "multi_chemistry",
  "partial_raw",
  "voltage_excursion_above_cutoff",
  "voltage_excursion_below_cutoff"
 ],
 "provenance": {
  "derived_from": "datasets/dataset_29.json",
  "generated": "2026-10-14",
  "field_sources": {
   "ref_name": "dataset_record",
   "category": "folder_layout",
   "timeseries.*": "processed_data",
   "soc.*": "derived",
   "soh.*": "derived",
   "capacity_degradation.*": "derived",
   "ocv.*": "derived",
   "internal_resistance.*": "raw_data",
   "eis.*": "raw_data",
   "thermal.*": "derived",
   "research_applicability.*": "derived",
   "suitable_tasks": "derived",
   "source_quality_flags": "dataset_record"
  },
  "confidence": "verified",
  "last_verified": "2026-10-14"
 }
}
