{
 "$schema": "../schema/batterylake-research-2.0.json",
 "schema_version": "2.0.0",
 "dataset_id": "dataset_18",
 "ref_name": "2022_A123_LFP_18650_1.1Ah_CalCyc_50T",
 "category": "cycle_aging",
 "timeseries": {
  "has_voltage_timeseries": true,
  "has_current_timeseries": true,
  "has_temperature_timeseries": false,
  "has_time_timeseries": true,
  "complete_v_i_t_timeseries": false,
  "resolution": "partial_waveforms",
  "signals_basis": "processed_data",
  "caveats": [
   "voltage_excursion_below_cutoff"
  ]
 },
 "soc": {
  "computable": true,
  "basis": "coulomb_counting_from_voltage_current"
 },
 "soh": {
  "computable": true,
  "basis": "curated_supported_tasks_and_raw_capacity_signal",
  "blocking_flags": [],
  "curated_task_present": true
 },
 "capacity_degradation": {
  "present": true,
  "aging_type": "mixed",
  "n_cycles_total": 84221,
  "cycles_per_entity_median": 3981.5
 },
 "ocv": {
  "present": true,
  "confidence": "confirmed",
  "basis": "landing: cells characterised every 100 cycles for capacity and pseudo-open-circuit voltage"
 },
 "internal_resistance": {
  "present": false,
  "confidence": "derivable",
  "basis": "Re(Z) at high frequency can be read from the raw impedance spectra"
 },
 "eis": {
  "present": true,
  "basis": "raw_data: impedance-spectroscopy sweeps (frequency and impedance channels or EIS files)"
 },
 "thermal": {
  "temperature_logging": false,
  "thermal_characterization": false,
  "application_domain": "lab",
  "aging_type": "mixed"
 },
 "research_applicability": {
  "parameter_identification": true,
  "piml_calibration": false,
  "soh_rul_prediction": true,
  "simulation": false,
  "synthetic_data_generation": false
 },
 "suitable_tasks": [
  "SOH_estimation",
  "RUL_prediction",
  "SOC_estimation",
  "digital_twin_calibration",
  "EIS_characterization",
  "OCV_curve_extraction"
 ],
 "source_quality_flags": [
  "voltage_excursion_below_cutoff"
 ],
 "provenance": {
  "derived_from": "datasets/dataset_18.json",
  "generated": "2026-10-13",
  "field_sources": {
   "ref_name": "dataset_record",
   "category": "folder_layout",
   "timeseries.*": "processed_data",
   "soc.*": "derived",
   "soh.*": "derived",
   "capacity_degradation.*": "derived",
   "ocv.*": "hand_checked",
   "internal_resistance.*": "raw_data",
   "eis.*": "raw_data",
   "thermal.*": "derived",
   "research_applicability.*": "derived",
   "suitable_tasks": "derived",
   "source_quality_flags": "dataset_record"
  },
  "confidence": "verified",
  "last_verified": "2026-10-09"
 }
}
