{
 "$schema": "../schema/batterylake-research-2.0.json",
 "schema_version": "2.0.0",
 "dataset_id": "dataset_05",
 "ref_name": "2021_RWTH_Aachen_NMC_18650_MultiC_MultiT",
 "category": "cycle_aging",
 "timeseries": {
  "has_voltage_timeseries": true,
  "has_current_timeseries": true,
  "has_temperature_timeseries": false,
  "has_time_timeseries": true,
  "complete_v_i_t_timeseries": false,
  "resolution": "partial_waveforms",
  "signals_basis": "processed_data",
  "caveats": [
   "unreadable_raw_files",
   "voltage_excursion_above_cutoff",
   "voltage_excursion_below_cutoff"
  ]
 },
 "soc": {
  "computable": true,
  "basis": "coulomb_counting_from_voltage_current"
 },
 "soh": {
  "computable": true,
  "basis": "curated_supported_tasks_and_raw_capacity_signal",
  "blocking_flags": [],
  "curated_task_present": true
 },
 "capacity_degradation": {
  "present": true,
  "aging_type": "cyclic",
  "n_cycles_total": 116749,
  "cycles_per_entity_median": 2507.5
 },
 "ocv": {
  "present": false,
  "confidence": null,
  "basis": null
 },
 "internal_resistance": {
  "present": true,
  "confidence": "confirmed",
  "basis": "raw_docs: Content_RWTH-2021-04545.pdf - pulse resistance tests in every BOL and RPT block"
 },
 "eis": {
  "present": false,
  "basis": null
 },
 "thermal": {
  "temperature_logging": true,
  "thermal_characterization": false,
  "application_domain": "lab",
  "aging_type": "cyclic"
 },
 "research_applicability": {
  "parameter_identification": true,
  "piml_calibration": true,
  "soh_rul_prediction": true,
  "simulation": true,
  "synthetic_data_generation": true
 },
 "suitable_tasks": [
  "SOH_estimation",
  "RUL_prediction",
  "SOC_estimation",
  "digital_twin_calibration",
  "simulation",
  "synthetic_data_generation"
 ],
 "source_quality_flags": [
  "unreadable_raw_files",
  "voltage_excursion_above_cutoff",
  "voltage_excursion_below_cutoff"
 ],
 "provenance": {
  "derived_from": "datasets/dataset_05.json",
  "generated": "2026-10-14",
  "field_sources": {
   "ref_name": "dataset_record",
   "category": "folder_layout",
   "timeseries.*": "processed_data",
   "soc.*": "derived",
   "soh.*": "derived",
   "capacity_degradation.*": "derived",
   "ocv.*": "derived",
   "internal_resistance.*": "hand_checked",
   "eis.*": "raw_data",
   "thermal.*": "derived",
   "research_applicability.*": "derived",
   "suitable_tasks": "derived",
   "source_quality_flags": "dataset_record"
  },
  "confidence": "verified",
  "last_verified": "2026-10-14"
 }
}
