{
 "$schema": "../schema/batterylake-research-2.0.json",
 "schema_version": "2.0.0",
 "dataset_id": "dataset_30",
 "ref_name": "2025_Beihang_LiIon_EV-BMS_MultiChem_MultiT",
 "category": "field_fault_diagnosis",
 "timeseries": {
  "has_voltage_timeseries": false,
  "has_current_timeseries": false,
  "has_temperature_timeseries": false,
  "has_time_timeseries": false,
  "complete_v_i_t_timeseries": false,
  "resolution": "unlabelled_channels",
  "signals_basis": "processed_data",
  "caveats": [
   "partial_raw",
   "processed_series_missing"
  ]
 },
 "soc": {
  "computable": false,
  "basis": null
 },
 "soh": {
  "computable": false,
  "basis": null,
  "blocking_flags": [],
  "curated_task_present": false
 },
 "capacity_degradation": {
  "present": false,
  "aging_type": "field",
  "n_cycles_total": null,
  "cycles_per_entity_median": null
 },
 "ocv": {
  "present": false,
  "confidence": null,
  "basis": null
 },
 "internal_resistance": {
  "present": false,
  "confidence": null,
  "basis": "no populated resistance column and no impedance measurement in the raw data"
 },
 "eis": {
  "present": false,
  "basis": null
 },
 "thermal": {
  "temperature_logging": false,
  "thermal_characterization": false,
  "application_domain": "EV_field",
  "aging_type": "field"
 },
 "research_applicability": {
  "parameter_identification": false,
  "piml_calibration": false,
  "soh_rul_prediction": false,
  "simulation": false,
  "synthetic_data_generation": false
 },
 "suitable_tasks": [
  "fault_diagnosis"
 ],
 "source_quality_flags": [
  "partial_raw"
 ],
 "provenance": {
  "derived_from": "datasets/dataset_30.json",
  "generated": "2026-10-14",
  "field_sources": {
   "ref_name": "dataset_record",
   "category": "folder_layout",
   "timeseries.*": "processed_data",
   "soc.*": "derived",
   "soh.*": "derived",
   "capacity_degradation.*": "derived",
   "ocv.*": "derived",
   "internal_resistance.*": "raw_data",
   "eis.*": "raw_data",
   "thermal.*": "derived",
   "research_applicability.*": "derived",
   "suitable_tasks": "derived",
   "source_quality_flags": "dataset_record"
  },
  "confidence": "verified",
  "last_verified": "2026-10-14"
 }
}
