{
 "$schema": "../schema/batterylake-research-2.0.json",
 "schema_version": "2.0.0",
 "dataset_id": "dataset_31",
 "ref_name": "2023_Mendeley_NMC811-LFP_18650_Relaxation_MultiT",
 "category": "eis",
 "timeseries": {
  "has_voltage_timeseries": true,
  "has_current_timeseries": true,
  "has_temperature_timeseries": false,
  "has_time_timeseries": true,
  "complete_v_i_t_timeseries": false,
  "resolution": "partial_waveforms",
  "signals_basis": "processed_data",
  "caveats": [
   "processed_series_missing",
   "voltage_excursion_above_cutoff"
  ]
 },
 "soc": {
  "computable": true,
  "basis": "coulomb_counting_from_voltage_current"
 },
 "soh": {
  "computable": true,
  "basis": "curated_supported_tasks_and_raw_capacity_signal",
  "blocking_flags": [],
  "curated_task_present": true
 },
 "capacity_degradation": {
  "present": false,
  "aging_type": "characterization",
  "n_cycles_total": 124,
  "cycles_per_entity_median": 10.0
 },
 "ocv": {
  "present": true,
  "confidence": "confirmed",
  "basis": "raw_data: depth-of-discharge relaxation (rest-step) tests"
 },
 "internal_resistance": {
  "present": false,
  "confidence": null,
  "basis": "no populated resistance column and no impedance measurement in the raw data"
 },
 "eis": {
  "present": false,
  "basis": null
 },
 "thermal": {
  "temperature_logging": false,
  "thermal_characterization": false,
  "application_domain": "lab",
  "aging_type": "characterization"
 },
 "research_applicability": {
  "parameter_identification": true,
  "piml_calibration": false,
  "soh_rul_prediction": false,
  "simulation": false,
  "synthetic_data_generation": false
 },
 "suitable_tasks": [
  "SOH_estimation",
  "SOC_estimation",
  "digital_twin_calibration",
  "OCV_curve_extraction"
 ],
 "source_quality_flags": [
  "multi_chemistry",
  "voltage_excursion_above_cutoff"
 ],
 "provenance": {
  "derived_from": "datasets/dataset_31.json",
  "generated": "2026-10-14",
  "field_sources": {
   "ref_name": "dataset_record",
   "category": "folder_layout",
   "timeseries.*": "processed_data",
   "soc.*": "derived",
   "soh.*": "derived",
   "capacity_degradation.*": "derived",
   "ocv.*": "hand_checked",
   "internal_resistance.*": "raw_data",
   "eis.*": "raw_data",
   "thermal.*": "derived",
   "research_applicability.*": "derived",
   "suitable_tasks": "derived",
   "source_quality_flags": "dataset_record"
  },
  "confidence": "verified",
  "last_verified": "2026-10-14"
 }
}
