{
 "$schema": "../schema/batterylake-research-2.0.json",
 "schema_version": "2.0.0",
 "dataset_id": "dataset_13",
 "ref_name": "2024_KIT_Luh_NMC_18650_MultiC_MultiC_MultiT",
 "category": "field_data",
 "timeseries": {
  "has_voltage_timeseries": true,
  "has_current_timeseries": true,
  "has_temperature_timeseries": true,
  "has_time_timeseries": true,
  "complete_v_i_t_timeseries": true,
  "resolution": "full_waveforms",
  "signals_basis": "processed_data",
  "caveats": [
   "processed_series_missing",
   "voltage_excursion_below_cutoff"
  ]
 },
 "soc": {
  "computable": true,
  "basis": "explicit_soc_column"
 },
 "soh": {
  "computable": true,
  "basis": "curated_supported_tasks_and_raw_capacity_signal",
  "blocking_flags": [],
  "curated_task_present": true
 },
 "capacity_degradation": {
  "present": true,
  "aging_type": "mixed",
  "n_cycles_total": 209438,
  "cycles_per_entity_median": 653.0
 },
 "ocv": {
  "present": true,
  "confidence": "estimated",
  "basis": "raw_data: ocv_est_V column, the authors' estimated open-circuit voltage"
 },
 "internal_resistance": {
  "present": true,
  "confidence": "estimated",
  "basis": "raw_data: R0_mOhm and R1_mOhm columns, the authors' estimates"
 },
 "eis": {
  "present": false,
  "basis": null
 },
 "thermal": {
  "temperature_logging": true,
  "thermal_characterization": false,
  "application_domain": "lab",
  "aging_type": "mixed"
 },
 "research_applicability": {
  "parameter_identification": true,
  "piml_calibration": true,
  "soh_rul_prediction": true,
  "simulation": true,
  "synthetic_data_generation": true
 },
 "suitable_tasks": [
  "SOH_estimation",
  "SOC_estimation",
  "digital_twin_calibration",
  "simulation",
  "synthetic_data_generation",
  "OCV_curve_extraction"
 ],
 "source_quality_flags": [
  "shared_cells_with_other_dataset",
  "voltage_excursion_below_cutoff"
 ],
 "provenance": {
  "derived_from": "datasets/dataset_13.json",
  "generated": "2026-10-14",
  "field_sources": {
   "ref_name": "dataset_record",
   "category": "folder_layout",
   "timeseries.*": "processed_data",
   "soc.*": "derived",
   "soh.*": "derived",
   "capacity_degradation.*": "derived",
   "ocv.*": "hand_checked",
   "internal_resistance.*": "hand_checked",
   "eis.*": "raw_data",
   "thermal.*": "derived",
   "research_applicability.*": "derived",
   "suitable_tasks": "derived",
   "source_quality_flags": "dataset_record"
  },
  "confidence": "verified",
  "last_verified": "2026-10-14"
 }
}
